mbti,ENTJ,ENTP,INTJ,INTP,ESTJ,ESFJ,ISTJ,ISFJ,ENFJ,ENFP,INFJ,INFP,ESTP,ESFP,ISTP,ISFP
INFJ,"자연스러운 소통이 이루어지고, 공통된 목표를 향해 나아갈 수 있지만, 역할이 모호하면 오해가 생길 수 있습니다.","부분적인 일치로 공통의 목표를 향해 나아갈 수 있지만, 완전한 일치가 어려워 때로는 대립이 발생할 수 있습니다.","INFJ의 기대에 부응하여 성장이 촉진되지만, 요구에 부응하지 못할 경우 스트레스가 강해질 수 있습니다.","서로를 높일 가능성이 있지만, 스트레스를 주지 않도록 주의가 필요합니다.",서로 다른 가치관으로 인해 자주 오해가 생기고 마찰이 끊이지 않는 관계입니다.,"한쪽이 높은 기준을 설정하고, 다른 쪽이 노력함으로써 성장이 촉진되지만, 압박감이 강해질 수 있습니다.",서로 다른 관점과 아이디어를 제시해 새로운 발견과 창의적인 해결책을 만들기 쉬운 관계입니다.,"서로의 강점을 살리며 협력할 수 있지만, 리더십이 과도하게 발휘되면 문제가 발생합니다.","비슷한 가치관과 행동 패턴을 가지고 있어 원활한 의사소통이 가능하고, 서로의 의도를 쉽게 이해할 수 있습니다.",서로의 행동이나 의도가 이해되지 않아 오해가 발생하기 쉬워 조화를 이루기 어렵습니다.,"같은 성향을 가져 높은 공감대를 형성하고, 대화가 자연스럽게 이어지는 관계입니다. 서로를 있는 그대로 받아들이며, 위로와 지지를 자연스럽게 주고받는 데 능숙합니다. 다만, 비슷한 약점을 공유해 어려운 상황에서 균형을 잡기가 힘들 수 있습니다.","다양한 관점을 가짐으로써 포괄적인 해결책을 찾기 쉽지만, 소통이 어색해지기 쉽습니다.",직관적인 이해를 통해 원활하게 의견을 교환할 수 있어 오해 없이 효과적인 소통이 가능합니다.,"서로의 관점이 달라 새로운 접근이 생길 수 있지만, 오해가 생기기 쉬워 대화가 어려워질 수 있습니다.","의견의 대립이 생기고, 건설적인 대화가 어려워 상호 이해가 필요합니다.","높은 기대에 부응함으로써 상대의 성장을 촉진할 수 있지만, 요구에 부응하지 못할 경우 좌절감이 커질 수 있습니다."
INFP,"가치관의 차이가 창의적인 해결책을 만들어 낼 가능성이 있지만, 오해가 생기기 쉬워 대화가 어색해질 수 있습니다.",높은 기준을 설정하는 ENTP와 그에 응하는 INFP의 관계로 성장이 기대됩니다.,"서로의 강점을 살려 효율적으로 협력할 수 있지만, 한쪽의 요구가 강하면 문제가 생길 수 있습니다.","공통의 목표로 협력하기 좋지만, 외부의 관점을 받아들이는 것이 필요합니다.",서로의 강점을 살리고 약점을 보완함으로써 이상적인 파트너가 될 수 있습니다,"한쪽이 방향을 정하고, 지원 역할이 구체적인 과제를 수행함으로써 협력 관계가 강화되지만, 과도한 지시는 마찰의 원인이 됩니다.",자기중심적인 행동이 오해를 일으키기 쉬워 갈등이 지속되는 관계입니다. 서로의 의견을 이해하려는 노력이 필요합니다.,"계획적인 진행이 가능하며 목표 달성에 효과적이지만, 지원 역할이 자유로움을 느끼지 못해 불만이 생길 수 있습니다.","다른 가치관으로 인해 의사소통이 어려워지고, 마찰이 자주 발생합니다. 서로의 차이를 이해하는 것이 중요합니다.",서로가 반영됨으로써 자기 이해를 깊게 하고 자연스러운 신뢰 관계가 형성됩니다. 공감하기 쉽습니다.,"다양한 관점을 가짐으로써 포괄적인 해결책을 찾기 쉽지만, 소통이 어색해지기 쉽습니다.","같은 성향을 가져 높은 공감대를 형성하고, 대화가 자연스럽게 이어지는 관계입니다. 서로를 있는 그대로 받아들이며, 위로와 지지를 자연스럽게 주고받는 데 능숙합니다. 다만, 비슷한 약점을 공유해 어려운 상황에서 균형을 잡기가 힘들 수 있습니다.",가치관의 차이로 마찰이 생기기 쉬우며 대화가 맞지 않을 수 있습니다.,"다른 시각에서 새로운 아이디어를 쉽게 창출할 수 있지만, 행동이나 의도의 오해로 긴장이 생기기 쉽습니다.","한쪽은 논리적이고 계획적, 다른 쪽은 직관적이고 유연한 사고를 가져 좋은 효과를 냅니다.","오해가 적고 원활하게 협력할 수 있지만, 새로운 시각이 부족할 수 있습니다."
ESTP,"공통된 가치관으로 원활하게 협력할 수 있지만, 외부의 피드백을 수용하는 것이 중요합니다.","효율적으로 목표를 달성할 수 있으며 자연스러운 협력이 가능하지만, 역할의 기대가 명확하지 않으면 마찰이 생기기 쉽습니다.","구체적인 목표를 설정하는 리더와 이에 응답하는 다른 쪽의 관계로 자극을 주고받지만, 압박감이 증가합니다.","서로 다른 가치를 가지고 있어 새로운 아이디어가 생기지만, 행동을 오해하기 쉬워 긴장이 생기기 쉽습니다.","다른 관점을 통해 새로운 아이디어가 생기지만, 가치관의 차이로 오해와 마찰이 자주 발생합니다.","새로운 시각을 얻을 수 있는 반면, 상대방의 행동이나 의도를 오해하기 쉬워 긴장이 생길 수 있는 관계입니다.",상대방의 반응을 관찰하여 자신의 행동 패턴을 이해하고 성장하는 관계입니다.,"공통의 목표를 향해 협력하기 쉽고, 순조롭게 일이 진행되지만, 새로운 시각을 얻기 위해서는 외부의 의견이 필요합니다.",서로가 자극이 되어 적극적으로 행동하게 됩니다. 지루할 틈이 없는 관계입니다.,너무 주장하면 상대의 의견이나 감정이 무시되어 충돌이 빈번합니다. 조화가 어렵습니다.,직관적인 이해를 통해 원활하게 의견을 교환할 수 있어 오해 없이 효과적인 소통이 가능합니다.,가치관의 차이로 마찰이 생기기 쉬우며 대화가 맞지 않을 수 있습니다.,"같은 성향을 가져 높은 공감대를 형성하고, 대화가 자연스럽게 이어지는 관계입니다. 서로를 있는 그대로 받아들이며, 위로와 지지를 자연스럽게 주고받는 데 능숙합니다. 다만, 비슷한 약점을 공유해 어려운 상황에서 균형을 잡기가 힘들 수 있습니다.","상대의 지시에 따름으로써 효율적으로 일이 진행되지만, 지시를 받은 쪽은 자율성을 발휘하기 어려워 스트레스를 느낍니다.",서로 다른 가치관으로 인해 자주 오해가 생기고 마찰이 끊이지 않는 관계입니다.,"부분적으로 유사하여 협력이 원활하지만, 완전한 조화는 어렵고 때때로 마찰이 발생할 수 있습니다."
ESFP,서로의 에너지를 높이고 적극적으로 행동하게끔 촉진시킵니다. 새로운 도전에 도전함으로써 항상 활기가 넘칩니다.,서로 다른 가치관으로 인해 자주 오해가 생기고 마찰이 끊이지 않는 관계입니다.,서로의 관점을 수용하여 새로운 아이디어와 해결책이 계속해서 생기고 성장을 촉진합니다.,서로 다른 가치관으로 인해 자주 오해가 생기고 마찰이 끊이지 않는 관계입니다.,"다른 가치관을 통해 새로운 아이디어가 생기기 쉽지만, 행동이나 의도가 오해를 받기 쉬워 마찰이 발생하기 쉽습니다.","다른 접근 방식으로 좋은 아이디어나 해결책을 찾기 쉽지만, 소통이 원활하지 않아 대립이 생기기 쉬운 관계입니다.","공통의 가치관과 목표를 가지고 협력이 원활하지만, 외부 피드백을 받아들이는 것이 중요합니다.","비슷한 가치관과 행동 패턴을 가지고 있어 원활한 소통이 가능하며, 서로의 의도를 이해하기 쉽습니다.","가치관이 공명하여 오해가 적은 관계이지만, 새로운 시각이 나오기 어려울 수 있습니다.",공통 가치관으로 자연스럽게 협력할 수 있지만 새로운 접근 방식이 나오기 어렵습니다.,"서로의 관점이 달라 새로운 접근이 생길 수 있지만, 오해가 생기기 쉬워 대화가 어려워질 수 있습니다.","다른 시각에서 새로운 아이디어를 쉽게 창출할 수 있지만, 행동이나 의도의 오해로 긴장이 생기기 쉽습니다.","상대의 지시에 따름으로써 효율적으로 일이 진행되지만, 지시를 받은 쪽은 자율성을 발휘하기 어려워 스트레스를 느낍니다.","같은 성향을 가져 높은 공감대를 형성하고, 대화가 자연스럽게 이어지는 관계입니다. 서로를 있는 그대로 받아들이며, 위로와 지지를 자연스럽게 주고받는 데 능숙합니다. 다만, 비슷한 약점을 공유해 어려운 상황에서 균형을 잡기가 힘들 수 있습니다.",한쪽이 아이디어를 내고 지원자가 이에 응답함으로써 일이 잘 진행됩니다.,서로 다른 가치관으로 인해 자주 오해가 생기고 마찰이 끊이지 않는 관계입니다.
ISTP,"리더십을 발휘하는 쪽과 지원하는 쪽이 협력하여 원활하게 일이 진행되지만, 과도한 지시는 마찰을 일으킬 수 있습니다.","ENTP의 지도와 ISTP의 실행으로 협력 관계가 생기기 쉽지만, 균형 잡힌 접근이 요구됩니다.","한쪽의 지시로 효율적으로 일이 진행되지만, 지원 역할이 자율성을 발휘하기 어렵고 스트레스를 받기 쉽습니다.","한쪽의 리더십으로 물건을 잘 진행할 수 있지만, 창의성이나 자율성이 발휘되기 어려워 스트레스가 증가하는 관계입니다.",서로의 행동을 통해 자기 이해를 깊게 하고 자기 개선의 기회를 얻을 수 있습니다. 공감하기 쉬운 관계입니다.,"규칙과 규율을 서로에게 요구하는 것이 효과적이지만, 지나치면 답답함을 느끼고 스트레스가 증가할 수 있습니다.","창의적인 해결책이 나오지만, 서로의 행동이나 의도가 이해되지 않아 대화가 어려워질 수 있습니다.","균형 잡힌 관계이지만, 한쪽이 상대방을 잘 이끌어야 합니다.",계획적인 접근과 감정적인 접근의 차이로 갈등이 빈번하게 발생해 협력이 어렵습니다.,서로의 생각이 잘 맞아 계획성과 창의성이 융합된 효과적인 접근이 가능합니다.,"의견의 대립이 생기고, 건설적인 대화가 어려워 상호 이해가 필요합니다.","한쪽은 논리적이고 계획적, 다른 쪽은 직관적이고 유연한 사고를 가져 좋은 효과를 냅니다.",서로 다른 가치관으로 인해 자주 오해가 생기고 마찰이 끊이지 않는 관계입니다.,한쪽이 아이디어를 내고 지원자가 이에 응답함으로써 일이 잘 진행됩니다.,"같은 성향을 가져 높은 공감대를 형성하고, 대화가 자연스럽게 이어지는 관계입니다. 서로를 있는 그대로 받아들이며, 위로와 지지를 자연스럽게 주고받는 데 능숙합니다. 다만, 비슷한 약점을 공유해 어려운 상황에서 균형을 잡기가 힘들 수 있습니다.","높은 기준을 ISFP에게 주면 성장을 촉진하지만, 과도한 요구는 스트레스나 불만을 초래할 수 있습니다."
ISFP,계획적이고 논리적인 한쪽과 감정적이고 즉흥적인 다른 한쪽의 차이가 마찰을 일으키기 쉽습니다.,자연스러운 협력과 이해가 생겨 깊은 신뢰를 쌓을 수 있습니다. 서로에게 이상적인 관계입니다.,의견이나 감정이 경시되어 의사소통이 대립적으로 변할 가능성이 있습니다.,새로운 경험과 모험을 공유함으로써 관계가 깊어지고 서로에게 자극적인 파트너십을 구축할 수 있습니다.,"서로의 가치관이 공명하기 쉬워 자연스럽게 신뢰 관계를 구축할 수 있지만, 새로운 관점이나 아이디어가 생기기 어렵습니다.",서로의 모습을 반영하여 자기의 장단점을 인식하는 데 도움을 주는 관계입니다. 공감과 신뢰가 자연스럽게 생깁니다.,"서로의 관점이 달라 새로운 접근이 나올 가능성이 있지만, 오해가 생기기 쉬운 관계입니다.","서로의 차이를 인식함으로써 성장이 촉진되지만, 오해를 방지하기 위해 주의가 필요합니다.","창의적인 해결책을 찾을 가능성이 있지만, 행동이나 의도의 오해가 생기기 쉬워 마찰이 일어나기 쉬운 관계입니다.","공통 가치관이 많아 협력이 쉽지만, 다른 접근 방식이 충돌을 일으킬 수 있습니다.","높은 기대에 부응함으로써 상대의 성장을 촉진할 수 있지만, 요구에 부응하지 못할 경우 좌절감이 커질 수 있습니다.","오해가 적고 원활하게 협력할 수 있지만, 새로운 시각이 부족할 수 있습니다.","부분적으로 유사하여 협력이 원활하지만, 완전한 조화는 어렵고 때때로 마찰이 발생할 수 있습니다.",서로 다른 가치관으로 인해 자주 오해가 생기고 마찰이 끊이지 않는 관계입니다.,"높은 기준을 ISFP에게 주면 성장을 촉진하지만, 과도한 요구는 스트레스나 불만을 초래할 수 있습니다.","같은 성향을 가져 높은 공감대를 형성하고, 대화가 자연스럽게 이어지는 관계입니다. 서로를 있는 그대로 받아들이며, 위로와 지지를 자연스럽게 주고받는 데 능숙합니다. 다만, 비슷한 약점을 공유해 어려운 상황에서 균형을 잡기가 힘들 수 있습니다."
